{"api_version":"kdlc.dev/agent-role/v1alpha1","role":"librarian","actor":"kdlc-librarian/0.2.0","review_only":false,"permissions":{"read":["workflow/runs/**","knowledge-bases/**"],"write":["workflow/runs/**/staging/indexes/**","workflow/runs/**/staging/aliases/**","workflow/runs/**/staging/relationships/**"]}}
